{
  "band_definitions": {
    "bands": [
      {
        "band": "small",
        "max_nodes": 16,
        "min_nodes": 1
      },
      {
        "band": "medium",
        "max_nodes": 128,
        "min_nodes": 17
      },
      {
        "band": "large",
        "max_nodes": 512,
        "min_nodes": 129
      }
    ],
    "binding": "bound",
    "binding_note": "Bound from the measured candidate distribution after the round-2 export: the lower observed cluster reaches 16 nodes and is assigned the 1-16 small class; the next observed cluster is 24-33 nodes and is assigned the 17-128 medium class; the 338-node motif-scale cluster is assigned the 129-512 large class. The boundaries follow observed cluster separation and power-of-two headroom above the observed maximum, rather than terminating at observed points."
  },
  "candidate_graphs": [
    {
      "band": "medium",
      "graph_id": "/Game/Probe/BP_SlicingProbe.BP_SlicingProbe:EventGraph",
      "id": "M7-C01",
      "licence": "project-owned",
      "measured": {
        "data_edge_count": 6,
        "edge_count": 20,
        "execution_edge_count": 14,
        "node_count": 24,
        "node_families": [
          {
            "class_path": "/Script/BlueprintGraph.K2Node_CallFunction",
            "count": 8
          },
          {
            "class_path": "/Script/BlueprintGraph.K2Node_CustomEvent",
            "count": 1
          },
          {
            "class_path": "/Script/BlueprintGraph.K2Node_Event",
            "count": 3
          },
          {
            "class_path": "/Script/BlueprintGraph.K2Node_ExecutionSequence",
            "count": 1
          },
          {
            "class_path": "/Script/BlueprintGraph.K2Node_IfThenElse",
            "count": 1
          },
          {
            "class_path": "/Script/BlueprintGraph.K2Node_Knot",
            "count": 2
          },
          {
            "class_path": "/Script/BlueprintGraph.K2Node_MacroInstance",
            "count": 1
          },
          {
            "class_path": "/Script/BlueprintGraph.K2Node_PromotableOperator",
            "count": 2
          },
          {
            "class_path": "/Script/BlueprintGraph.K2Node_VariableGet",
            "count": 3
          },
          {
            "class_path": "/Script/BlueprintGraph.K2Node_VariableSet",
            "count": 2
          }
        ]
      },
      "object_path": "/Game/Probe/BP_SlicingProbe.BP_SlicingProbe",
      "provenance": {
        "detail": "Retained M3 production-pipeline candidate graph authored in the Blueprint Lens project.",
        "origin": "authored_in_project",
        "recorded_on": "2026-08-21"
      },
      "risk_dimensions": [
        {
          "dimension": "source_traceability_and_progressive_disclosure",
          "unchecked_reason": "Progressive disclosure is a renderer property and the retained typed graph exposes no non-tautological predicate for it; source identity is node_guid on every node.",
          "verification": "declared_unverified"
        }
      ]
    },
    {
      "band": "small",
      "graph_id": "/Game/LensCorpus/BP_LensCorpus_Main.BP_LensCorpus_Main:EvaluateEncounter",
      "id": "M7-C02",
      "licence": "project-owned",
      "measured": {
        "data_edge_count": 6,
        "edge_count": 15,
        "execution_edge_count": 9,
        "node_count": 11,
        "node_families": [
          {
            "class_path": "/Script/BlueprintGraph.K2Node_FunctionEntry",
            "count": 1
          },
          {
            "class_path": "/Script/BlueprintGraph.K2Node_FunctionResult",
            "count": 1
          },
          {
            "class_path": "/Script/BlueprintGraph.K2Node_IfThenElse",
            "count": 2
          },
          {
            "class_path": "/Script/BlueprintGraph.K2Node_PromotableOperator",
            "count": 2
          },
          {
            "class_path": "/Script/BlueprintGraph.K2Node_VariableGet",
            "count": 1
          },
          {
            "class_path": "/Script/BlueprintGraph.K2Node_VariableSet",
            "count": 4
          }
        ]
      },
      "object_path": "/Game/LensCorpus/BP_LensCorpus_Main.BP_LensCorpus_Main",
      "provenance": {
        "detail": "Retained M3 production-pipeline candidate graph authored in the Blueprint Lens project.",
        "origin": "authored_in_project",
        "recorded_on": "2026-08-21"
      },
      "risk_dimensions": [
        {
          "dimension": "branching_and_incomparable_outcomes",
          "verification": "structural"
        }
      ]
    },
    {
      "band": "small",
      "graph_id": "/Game/LensCorpus/BP_LensCorpus_Main.BP_LensCorpus_Main:ComputeReadiness",
      "id": "M7-C03",
      "licence": "project-owned",
      "measured": {
        "data_edge_count": 6,
        "edge_count": 8,
        "execution_edge_count": 2,
        "node_count": 6,
        "node_families": [
          {
            "class_path": "/Script/BlueprintGraph.K2Node_FunctionEntry",
            "count": 1
          },
          {
            "class_path": "/Script/BlueprintGraph.K2Node_FunctionResult",
            "count": 1
          },
          {
            "class_path": "/Script/BlueprintGraph.K2Node_PromotableOperator",
            "count": 2
          },
          {
            "class_path": "/Script/BlueprintGraph.K2Node_VariableGet",
            "count": 1
          },
          {
            "class_path": "/Script/BlueprintGraph.K2Node_VariableSet",
            "count": 1
          }
        ]
      },
      "object_path": "/Game/LensCorpus/BP_LensCorpus_Main.BP_LensCorpus_Main",
      "provenance": {
        "detail": "Retained M3 production-pipeline candidate graph authored in the Blueprint Lens project.",
        "origin": "authored_in_project",
        "recorded_on": "2026-08-21"
      },
      "risk_dimensions": [
        {
          "dimension": "data_provenance_fan_in_fan_out",
          "verification": "structural"
        }
      ]
    },
    {
      "band": "small",
      "graph_id": "/Game/LensCorpus/BP_LensCorpus_Main.BP_LensCorpus_Main:CallService",
      "id": "M7-C04",
      "licence": "project-owned",
      "measured": {
        "data_edge_count": 4,
        "edge_count": 7,
        "execution_edge_count": 3,
        "node_count": 5,
        "node_families": [
          {
            "class_path": "/Script/BlueprintGraph.K2Node_CallFunction",
            "count": 1
          },
          {
            "class_path": "/Script/BlueprintGraph.K2Node_FunctionEntry",
            "count": 1
          },
          {
            "class_path": "/Script/BlueprintGraph.K2Node_FunctionResult",
            "count": 1
          },
          {
            "class_path": "/Script/BlueprintGraph.K2Node_VariableGet",
            "count": 1
          },
          {
            "class_path": "/Script/BlueprintGraph.K2Node_VariableSet",
            "count": 1
          }
        ]
      },
      "object_path": "/Game/LensCorpus/BP_LensCorpus_Main.BP_LensCorpus_Main",
      "provenance": {
        "detail": "Retained M3 production-pipeline candidate graph authored in the Blueprint Lens project.",
        "origin": "authored_in_project",
        "recorded_on": "2026-08-21"
      },
      "risk_dimensions": [
        {
          "dimension": "call_and_context",
          "verification": "structural"
        }
      ]
    },
    {
      "band": "small",
      "graph_id": "/Game/LensCorpus/BP_LC4_AsyncBarrier.BP_LC4_AsyncBarrier:EventGraph",
      "id": "M7-C05",
      "licence": "project-owned",
      "measured": {
        "data_edge_count": 0,
        "edge_count": 11,
        "execution_edge_count": 11,
        "node_count": 11,
        "node_families": [
          {
            "class_path": "/Script/BlueprintGraph.K2Node_CallFunction",
            "count": 8
          },
          {
            "class_path": "/Script/BlueprintGraph.K2Node_Event",
            "count": 1
          },
          {
            "class_path": "/Script/BlueprintGraph.K2Node_ExecutionSequence",
            "count": 1
          },
          {
            "class_path": "/Script/BlueprintGraph.K2Node_VariableSet",
            "count": 1
          }
        ]
      },
      "object_path": "/Game/LensCorpus/BP_LC4_AsyncBarrier.BP_LC4_AsyncBarrier",
      "provenance": {
        "detail": "Retained M3 production-pipeline candidate graph authored in the Blueprint Lens project.",
        "origin": "authored_in_project",
        "recorded_on": "2026-08-21"
      },
      "risk_dimensions": [
        {
          "dimension": "sequence_async_completion_and_synchronization",
          "verification": "structural"
        }
      ]
    },
    {
      "band": "small",
      "graph_id": "/Game/LensCorpus/BP_LC6_BoundaryMatrix.BP_LC6_BoundaryMatrix:EventGraph",
      "id": "M7-C06",
      "licence": "project-owned",
      "measured": {
        "data_edge_count": 1,
        "edge_count": 12,
        "execution_edge_count": 11,
        "node_count": 16,
        "node_families": [
          {
            "class_path": "/Script/BlueprintGraph.K2Node_CallFunction",
            "count": 2
          },
          {
            "class_path": "/Script/BlueprintGraph.K2Node_CustomEvent",
            "count": 4
          },
          {
            "class_path": "/Script/BlueprintGraph.K2Node_Select",
            "count": 1
          },
          {
            "class_path": "/Script/BlueprintGraph.K2Node_VariableSet",
            "count": 9
          }
        ]
      },
      "object_path": "/Game/LensCorpus/BP_LC6_BoundaryMatrix.BP_LC6_BoundaryMatrix",
      "provenance": {
        "detail": "Retained M3 production-pipeline candidate graph authored in the Blueprint Lens project.",
        "origin": "authored_in_project",
        "recorded_on": "2026-08-21"
      },
      "risk_dimensions": [
        {
          "dimension": "opaque_unsupported_and_query_budget_boundaries",